{
  "report_id": "fixture-validation-d-async-function",
  "artifact": "fixture.typescript_importer.d_async_function",
  "layer": "scir_h",
  "validator": "typescript-phase7-placeholder-bundle",
  "spec_version": "v0.1-draft",
  "status": "fail",
  "diagnostics": [
    {
      "code": "TS-PH102",
      "severity": "error",
      "message": "This reserved Phase 7 rejected boundary placeholder records that async function declarations remain outside the first TypeScript interface-only slice; canonical SCIR-H is intentionally absent and no live TypeScript importer has executed.",
      "location": "source.ts:1"
    }
  ]
}
