{
  "report_id": "fixture-validation-c-unsafe-call",
  "artifact": "fixture.rust_importer.c_unsafe_call",
  "layer": "scir_h",
  "validator": "rust-bootstrap-importer",
  "spec_version": "v0.1-draft",
  "status": "warn",
  "diagnostics": [
    {
      "code": "RS-C001",
      "severity": "warn",
      "message": "unsafe_ping remains an explicit Tier C unsafe boundary with capability accounting in the Rust bootstrap slice.",
      "location": "input/src/lib.rs:6"
    }
  ]
}
