{
  "report_id": "fixture-validation-a-interface-local-witness-use",
  "artifact": "fixture.typescript_importer.a_interface_local_witness_use",
  "layer": "scir_h",
  "validator": "typescript-phase7-placeholder-bundle",
  "spec_version": "v0.1-draft",
  "status": "fail",
  "diagnostics": [
    {
      "code": "TS-PH002",
      "severity": "error",
      "message": "This archived TypeScript placeholder remains outside the active SCIR boundary; canonical SCIR-H is intentionally absent and no live TypeScript importer, validation, lowering, reconstruction, benchmark, or executable D-JS path has run.",
      "location": "source.ts:1"
    }
  ]
}
